{
  "api_version": "1.0.0",
  "model": "DM3058",
  "family": "DMM",
  "manufacturer": "Rigol",
  "notes": "5.5 Digit Benchtop",
  "inherited_from": "34401A",
  "service": {
    "host": "0.0.0.0",
    "port": 15411,
    "family_lane": {
      "family_index": 4,
      "base": 15400,
      "offset": 11
    },
    "path": "/api/instrument/DMM/DM3058",
    "routes": {
      "spec": "/api/instrument/DMM/DM3058/DM3058.api.json",
      "health": "/api/instrument/DMM/DM3058/health",
      "get": "/api/instrument/DMM/DM3058/get/<command>",
      "set": "/api/instrument/DMM/DM3058/set/<command>",
      "nab": "/api/instrument/DMM/DM3058/nab/<command>",
      "rig": "/api/instrument/DMM/DM3058/rig/<command>",
      "do": "/api/instrument/DMM/DM3058/do/<command>"
    },
    "socket": {
      "ws": "/ws/instrument/DMM/DM3058",
      "readings": "/ws/instrument/DMM/DM3058/readings",
      "unix": "/run/apk/instruments/DMM.DM3058.sock"
    }
  },
  "transport": {
    "_note": "Protocol constants, not a per-model interface inventory. Which of these a box actually answers on is measured by the discovery sweep and recorded in the family probe file.",
    "default": "raw_socket",
    "visa": {
      "lan": "TCPIP0::<host>::inst0::INSTR",
      "raw": "TCPIP0::<host>::5025::SOCKET",
      "hislip": "TCPIP0::<host>::hislip0::INSTR",
      "gpib": "GPIB0::<address>::INSTR",
      "usb": "USB0::<vid>::<pid>::<serial>::INSTR",
      "serial": "ASRL<n>::INSTR"
    },
    "sockets": {
      "raw_socket": {
        "port": 5025,
        "kind": "tcp",
        "write_terminator": "\n",
        "read_terminator": "\n",
        "description": "Bare SCPI over TCP. No session layer, no discovery."
      },
      "hislip": {
        "port": 4880,
        "kind": "tcp",
        "description": "IVI HiSLIP. Carries SRQ and device clear, unlike the raw socket."
      },
      "vxi11": {
        "port": 111,
        "kind": "tcp",
        "description": "SUNRPC portmapper only; the core channel port is negotiated per session."
      },
      "telnet": {
        "port": 5024,
        "kind": "tcp",
        "description": "Human-facing SCPI prompt. Echoes and prints a banner \u2014 do not parse."
      }
    }
  },
  "verb_mapping": {
    "get": "Queries, observations, telemetry and status readings (identical to NAB)",
    "set": "Single parameter mutation and write commands",
    "nab": "Observation and telemetry acquisition queries",
    "rig": "Multi-argument system configuration setup commands",
    "do": "Zero-argument execution actions and trigger commands"
  },
  "summary": {
    "total_commands": 163,
    "get_count": 75,
    "set_count": 47,
    "nab_count": 75,
    "rig_count": 5,
    "do_count": 36
  },
  "endpoints": {
    "get": {
      "Fetch_Existing": {
        "command": "Fetch_Existing",
        "verb": "get",
        "description": "Fetch Existing",
        "scpi": ":FETCh?",
        "scpi_fast": ":FETC?",
        "subsystem": "MEASure",
        "group": "Fetch data after INITiate",
        "args": [],
        "arg": {
          "kind": "none"
        },
        "returns": {
          "count": 1
        },
        "mqtt": {
          "topic": "APK.audio/Gui/Komands/DMM/Fetch_Existing",
          "direction": "in",
          "payload_format": {
            "command": "Fetch_Existing"
          },
          "reading_topic": "APK.audio/Device/<device>/Reading/Fetch_Existing",
          "reading_direction": "out"
        },
        "unverified": false
      },
      "Get_Average_Average": {
        "command": "Get_Average_Average",
        "verb": "get",
        "description": "Math Operation Commands",
        "scpi": ":AVERage:AVERage?",
        "scpi_fast": ":AVER:AVER?",
        "subsystem": "AVER",
        "group": "AVER",
        "args": [],
        "arg": {
          "kind": "none"
        },
        "returns": {
          "count": 1,
          "type": "NR1"
        },
        "mqtt": {
          "topic": "APK.audio/Gui/Komands/DMM/Get_Average_Average",
          "direction": "in",
          "payload_format": {
            "command": "Get_Average_Average"
          },
          "reading_topic": "APK.audio/Device/<device>/Reading/Get_Average_Average",
          "reading_direction": "out"
        },
        "unverified": true
      },
      "Get_Average_Count": {
        "command": "Get_Average_Count",
        "verb": "get",
        "description": "Math Operation Commands",
        "scpi": ":AVERage:COUNt?",
        "scpi_fast": ":AVER:COUN?",
        "subsystem": "AVER",
        "group": "AVER",
        "args": [],
        "arg": {
          "kind": "none"
        },
        "returns": {
          "count": 1,
          "type": "NR1"
        },
        "mqtt": {
          "topic": "APK.audio/Gui/Komands/DMM/Get_Average_Count",
          "direction": "in",
          "payload_format": {
            "command": "Get_Average_Count"
          },
          "reading_topic": "APK.audio/Device/<device>/Reading/Get_Average_Count",
          "reading_direction": "out"
        },
        "unverified": true
      },
      "Get_Beeper_State": {
        "command": "Get_Beeper_State",
        "verb": "get",
        "description": "System-Related Commands",
        "scpi": ":BEEPer:STATe?",
        "scpi_fast": ":BEEP:STAT?",
        "subsystem": "BEEP",
        "group": "BEEP",
        "args": [],
        "arg": {
          "kind": "none"
        },
        "returns": {
          "count": 1,
          "type": "BOOL"
        },
        "mqtt": {
          "topic": "APK.audio/Gui/Komands/DMM/Get_Beeper_State",
          "direction": "in",
          "payload_format": {
            "command": "Get_Beeper_State"
          },
          "reading_topic": "APK.audio/Device/<device>/Reading/Get_Beeper_State",
          "reading_direction": "out"
        },
        "unverified": true
      },
      "Get_Calculate_Average_Count": {
        "command": "Get_Calculate_Average_Count",
        "verb": "get",
        "description": "Math Operations",
        "scpi": "CALCulate:AVERage:COUNt?",
        "scpi_fast": "CALC:AVER:COUN?",
        "subsystem": "CALC",
        "group": "CALC",
        "args": [],
        "arg": {
          "kind": "none"
        },
        "returns": {
          "count": 1,
          "type": "NR1"
        },
        "mqtt": {
          "topic": "APK.audio/Gui/Komands/DMM/Get_Calculate_Average_Count",
          "direction": "in",
          "payload_format": {
            "command": "Get_Calculate_Average_Count"
          },
          "reading_topic": "APK.audio/Device/<device>/Reading/Get_Calculate_Average_Count",
          "reading_direction": "out"
        },
        "unverified": true
      },
      "Get_Calculate_Db_Reference": {
        "command": "Get_Calculate_Db_Reference",
        "verb": "get",
        "description": "Get calculate db reference",
        "scpi": "CALCulate:DB:REFerence?",
        "scpi_fast": "CALC:DB:REF?",
        "subsystem": "CALC",
        "group": "CALC",
        "args": [],
        "arg": {
          "kind": "none"
        },
        "returns": {
          "count": 1,
          "type": "CRD"
        },
        "mqtt": {
          "topic": "APK.audio/Gui/Komands/DMM/Get_Calculate_Db_Reference",
          "direction": "in",
          "payload_format": {
            "command": "Get_Calculate_Db_Reference"
          },
          "reading_topic": "APK.audio/Device/<device>/Reading/Get_Calculate_Db_Reference",
          "reading_direction": "out"
        },
        "unverified": true
      },
      "Get_Calculate_Function": {
        "command": "Get_Calculate_Function",
        "verb": "get",
        "description": "Get calculate function",
        "scpi": "CALCulate:FUNCtion?",
        "scpi_fast": "CALC:FUNC?",
        "subsystem": "CALC",
        "group": "CALC",
        "args": [],
        "arg": {
          "kind": "none"
        },
        "returns": {
          "count": 1,
          "type": "CRD"
        },
        "mqtt": {
          "topic": "APK.audio/Gui/Komands/DMM/Get_Calculate_Function",
          "direction": "in",
          "payload_format": {
            "command": "Get_Calculate_Function"
          },
          "reading_topic": "APK.audio/Device/<device>/Reading/Get_Calculate_Function",
          "reading_direction": "out"
        },
        "unverified": true
      },
      "Get_Calculate_Limit_Lower": {
        "command": "Get_Calculate_Limit_Lower",
        "verb": "get",
        "description": "Math Operations",
        "scpi": "CALCulate:LIMit:LOWer?",
        "scpi_fast": "CALC:LIM:LOW?",
        "subsystem": "CALC",
        "group": "CALC",
        "args": [],
        "arg": {
          "kind": "none"
        },
        "returns": {
          "count": 1
        },
        "mqtt": {
          "topic": "APK.audio/Gui/Komands/DMM/Get_Calculate_Limit_Lower",
          "direction": "in",
          "payload_format": {
            "command": "Get_Calculate_Limit_Lower"
          },
          "reading_topic": "APK.audio/Device/<device>/Reading/Get_Calculate_Limit_Lower",
          "reading_direction": "out"
        },
        "unverified": true
      },
      "Get_Calculate_Limit_Upper": {
        "command": "Get_Calculate_Limit_Upper",
        "verb": "get",
        "description": "Math Operations",
        "scpi": "CALCulate:LIMit:UPPer?",
        "scpi_fast": "CALC:LIM:UPP?",
        "subsystem": "CALC",
        "group": "CALC",
        "args": [],
        "arg": {
          "kind": "none"
        },
        "returns": {
          "count": 1
        },
        "mqtt": {
          "topic": "APK.audio/Gui/Komands/DMM/Get_Calculate_Limit_Upper",
          "direction": "in",
          "payload_format": {
            "command": "Get_Calculate_Limit_Upper"
          },
          "reading_topic": "APK.audio/Device/<device>/Reading/Get_Calculate_Limit_Upper",
          "reading_direction": "out"
        },
        "unverified": true
      },
      "Get_Calculate_Null_Offset": {